Agency Name,Agency Code
Department of the Air Force - Agency Wide,AF00
Department of Agriculture - Agency Wide,AG00
National Foundation on the Arts and the Humanities - Agency Wide,AH00
Department of the Army - Agency Wide,AR00
Department of Commerce - Agency Wide,CM00
Department of Defense - Agency Wide,DD00
Department of Justice - Agency Wide,DJ00
Department of Energy - Agency Wide,DN00
Department of Education - Agency Wide,ED00
Court Services and Offender Supervision Agency for DC - Agency Wide,FQ00
General Services Administration - Agency Wide,GS00
Department of Health and Human Services - Agency Wide,HE00
Department of Homeland Security - Agency Wide,HS00
Department of Housing and Urban Development - Agency Wide,HU00
Department of the Interior - Agency Wide,IN00
Judicial Branch - Agency Wide,JL00
Legislative Branch - Agency Wide,LL00
National Aeronautics and Space Administration - Agency Wide,NN00
Department of the Navy - Agency Wide,NV00
Department of State - Agency Wide,ST00
Department of Transportation - Agency Wide,TD00
Department of the Treasury - Agency Wide,TR00
Department of Veterans Affairs - Agency Wide,VA00
Department of the Air Force,AF
Department of Agriculture,AG
Department of the Army,AR
Department of Commerce,CM
Department of Defense,DD
Department of Justice,DJ
Department of Labor,DL
Department of Education,ED
Department of Energy,DN
General Services Administration,GS
Department of Health and Human Services,HE
Department of Homeland Security,HS
Department of Housing and Urban Development,HU
Department of the Interior,IN
National Aeronautics and Space Administration,NN
Department of the Navy,NV
Armed Forces Retirement Homes,RH
Department of State,ST
Department of Transportation,TD
Department of the Treasury,TR
Department of Veterans Affairs,VA
Executive Office of the President,EOP
Central Intelligence Agency,CI
Court Services and Offender Supervision Agency for DC,FQ
Judicial Branch,JL
Legislative Branch,LL
Smithsonian Institution,SM
National Transportation Safety Board,TB
Air Force Inspection Agency (FO),AF02
Air Force Operational Test and Evaluation Center,AF03
Air Force Communications Agency (Historical),AF04
Air Force Intelligence Analysis Agency,AF05
Air Force Audit Agency,AF06
Air Force Office of Special Investigations,AF07
"Headquarters, U.S. Air Force Security Forces Center",AF08
Air Force Personnel Center,AF09
U.S. Air Force Academy,AF0B
"U.S. Air Forces, Europe",AF0D
Air Force Reserve Personnel Center,AF0I
Air Education and Training Command,AF0J
Air University,AF0K
"Headquarters, Air Force Reserve Command",AF0M
"Immediate Office, Headquarters, USAF",AF0N
Pacific Air Forces,AF0R
"Air Force Intelligence, Surveillance, & Reconnaissance Agency",AF0U
Air Force Communications Command,AF0Y
Air Force Center for Quality & Management Innovation,AF10
Air Combat Command,AF1C
Air Force Logistics Management Agency,AF1G
Air Mobility Command,AF1L
Air Force Materiel Command,AF1M
Air Force Real Property Agency,AF1P
HQ AF Flight Standards Agency,AF1Q
"Headquarters, Air Force Space Command",AF1S
Engineering and Support Agency,AF1W
Air Force Agency for Modeling and Simulation,AF27
Air Force Communication and Information Center,AF28
Air Force National Security Emergency Preparedness,AF29
Air Force Cost Analysis Agency,AF2A
Air Force Doctrine Center,AF2B
Air Force Civilian Personnel Management Center,AF2C
Air Force Personnel Operations Agency,AF2D
Air Force Legal Operations Agency,AF2E
Air Force Medical Support Agency,AF2F
Air Force Service Information and News Center,AF2G
Air Force Operations Group,AF2H
Air National Guard Readiness Center,AF2I
Air Force Historical Research Agency,AF2K
Air Force Technical Applications Center,AF2L
Air Force Review Boards Agency,AF2M
Air Force Studies and Analyses Agency,AF2N
Air Force Center for International Programs,AF2P
"Headquarters, Air Weather Agency",AF2Q
Air Force Program Executive Office,AF2R
Air Force Elements NORAD,AF2S
Air Force Safety Center,AF2T
Air Force Services Agency,AF2U
Air Force Disposal Agency,AF2V
11th Wing,AF2W
Air Force Real Estate Agency,AF2X
Air Force Pentagon Communications Agency,AF2Y
Air Force Medical,AF2Z
Air National Guard,AF34
"Air Force Elements, U.S. Central Command",AF3C
"Air Force Elements, U.S. Special Operations Command",AF3D
"Air Force Elements, NATO",AF3G
"Reservist, Centrally Managed",AF3I
Center for Air Force History,AF3L
"Air Force Elements, U.S. Southern Command",AF3M
"Air Force Elements, U.S. Joint Forces Command",AF3N
"Air Force Elements, U.S. Pacific Command",AF3O
"Air Force Elements, U.S. Strategic Command",AF3Q
"Air Force Elements, US Readiness Command",AF3R
Space Command and NORAD,AF3S
"Air Force Elements, U.S. Transportation Command",AF3T
Air Force Elements,AF3V
Air Force Center for Engineer & Environment,AF3W
Air Force Frequency Management Agency,AF3Y
"Joint Services Survival, Evasion, Resistance & Escape Agency",AF3Z
Air National Guard Units,AFNG
U.S. Special Operations Command (ANG),AFZG
"Air Force, Special Operations Command",AFZS
Office of the Secretary of Agriculture,AG01
Agricultural Marketing Service,AG02
Agricultural Research Service,AG03
"Agriculture, Rural Development",AG07
Risk Management Agency,AG08
Foreign Agricultural Service,AG10
Forest Service,AG11
Office of Communications,AG13
Office of the General Counsel,AG14
Rural Utilities Service,AG15
Natural Resources Conservation Service,AG16
Economic Research Service,AG18
National Agricultural Statistics Service,AG20
National Institute of Food and Agriculture,AG22
Office of the Inspector General,AG23
Rural Business-Cooperative Service,AG32
Animal and Plant Health Inspection Service,AG34
"Grain Inspection, Packers and Stockyards Administration",AG36
Food Safety and Inspection Service,AG37
Office of the Chief Economist,AG38
Office of Budget and Program Analysis,AG42
"Agriculture, Office of the Chief Financial Officer",AG90
Alternative Agric Res & Commercialization -terminated,AGAW
Civil Rights,AGCR
Departmental Administration,AGDA
Small & Disadvantaged Business Utilization -terminated,AGDB
Office of the Executive Secretariat,AGES
Farm Service Agency,AGFA
Homeland Security Staff,AGHS
Office of the Chief Information Officer,AGIT
Office of Hearings and Appeals,AGNA
Rural Development Support Services - terminated Sept 2003,AGSB
U.S. Army Intelligence and Security Command,ARAS
U.S. Army Test and Evaluation Command,ARAT
U.S. Army Audit Agency,ARAU
Army Installation Management Command,ARBA
United States Army Criminal Investigation Division,ARCB
Army Corps of Engineers,ARCD
Office of the Chief of Staff of the Army,ARCS
Army Information Systems Command,ARCZ
59th Ordnance Brigade,ARE0
Immediate Office of the Commander-in-Chief of the U.S. Army,ARE1
21st Theater Sustainment Command (TSC),ARE2
United States Army Europe and Africa,ARE3
U.S. Army V Corps,ARE5
1st Personnel Command,AREB
"U.S. Military Community Activity, Heidelberg",ARED
Seventh Army Training Command,AREN
U.S. Army Forces Command,ARFC
Office of the Chief of the National Guard Bureau,ARGB
U.S. Army Reserve Command,ARHR
U.S. Army Health Services Command,ARHS
U.S. Army Element SHAPE,ARJ1
Joint Activities,ARJA
U.S. Military Academy,ARMA
U.S. Army Medical Command,ARMC
Surgeon General,ARMD
Army Human Resources Command,ARMP
Military Surface Deployment and Distribution Command,ARMT
U.S. Army Military District of Washington,ARMW
Army National Guard Units,ARNG
"U.S. Army, Pacific",ARP1
Eighth U.S. Army,ARP8
Military Entrance Processing Command,ARPC
U.S. Army Recruiting Command,ARRC
Office of the Secretary of the Army,ARSA
Field Operating Offices of the Office of the Secretary of the Army,ARSB
U.S. Army Space and Missile Defense Command/U. S. Army Forces Strategic Command,ARSC
HQDA Field Operating Agencies and Staff Support Agencies,ARSE
Miscellaneous Field Operating Agencies,ARSF
"Joint Services and Activities Supported by the Office, Secretary of the Army",ARSJ
U.S. Special Operations Command (Army),ARSP
Staff Support Agencies of Chief of Staff,ARSS
U.S. Army Southern Command,ARSU
U.S. Army Training and Doctrine Command,ARTC
"Headquarters, AMC",ARX2
"Headquarters, Staff Support Activities, AMC",ARX3
"Training Activities, AMC",ARX4
"Army Materiel Command, All Others",ARX5
U.S. Army Aviation and Missile Command,ARX6
Army Tank-Automotive and Armament Command (TACOM),ARX7
U.S. Army Communications Electronics Command,ARX8
United States Army Medical Logistics Command,ARX9
United States Army Installation Management Command,ARXA
U.S. Army Chemical Materials Activity,ARXB
U.S. Army Sustainment Command,ARXC
U.S. Army Contracting Command,ARXD
Materiel Acquisition Activities,ARXK
Materiel Acquisition Project Managers,ARXL
U.S. Army Security Assistance Command,ARXP
U.S. Army Joint Munitions Command,ARXQ
U.S. Army Military Surface Deployment and Distribution Command,ARXT
U.S. Army Data Analysis Center,ARXX
Technology Administration,CM33
Office of the Secretary,CM51
Economic Development Administration,CM52
Bureau of Economic Analysis,CM53
National Oceanic and Atmospheric Administration,CM54
"Commerce, International Trade Administration",CM55
Patent and Trademark Office,CM56
National Institute of Standards and Technology,CM57
Minority Business Development Agency,CM59
National Telecommunications and Information Administration,CM61
National Technical Information Service,CM62
U.S. Census Bureau,CM63
Office of the Inspector General,CM64
Economics and Statistics Administration,CM65
Bureau of Industry and Security,CM67
Office of the Secretary of Defense,DD01
Organization of the Joint Chiefs of Staff,DD02
Defense Information Systems Agency,DD04
Defense Intelligence Agency,DD05
Defense Security Cooperation Agency,DD06
Defense Logistics Agency,DD07
U.S. Court of Appeals for the Armed Forces,DD08
American Forces Information Service,DD09
Defense Contract Audit Agency,DD10
National Geospatial-Intelligence Agency,DD11
Defense Counterintelligence and Security Agency,DD12
Defense Advanced Research Projects Agency,DD13
Uniformed Services University of the Health Sciences,DD15
Department of Defense Education Activity,DD16
TRI-CARE Support Office - terminated March 2001,DD17
Washington Headquarters Services,DD21
Office of the Local Defense Community Corporation,DD23
Defense Legal Services Agency,DD25
Office of Inspector General,DD26
Missile Defense Agency,DD27
National Security Agency/Central Security Service,DD28
Defense Technology Security Administration,DD29
Defense Commissary Agency,DD34
Defense Finance and Accounting Service,DD35
Army and Air Force Exchange Service (nonappropriated fund),DD36
Defense Human Resources Activity,DD48
Defense Support Activity - terminated March 2001,DD50
Defense Prisoner of War/Missing Personnel Office,DD58
Consolidated Metropolitan Technical Personnel Center,DD59
Defense Health Agency,DD60
Defense Threat Reduction Agency,DD61
Defense Career Management and Support Agency,DD62
Defense Contract Management Agency,DD63
Eastern Regional Support Center,DD64
Pentagon Force Protection Agency,DD65
Department of Defense Counterintelligence Field Activity,DD66
"Offices, Boards and Divisions",DJ01
Federal Bureau of Investigation,DJ02
"Justice, Bureau of Prisons/Federal Prison System",DJ03
Drug Enforcement Administration,DJ06
Office of Justice Programs,DJ07
U.S. Marshals Service,DJ08
Executive Office for U.S. Attorneys and the Office of the U.S. Attorneys,DJ09
Office of the Inspector General,DJ10
U.S. Trustee Program,DJ11
Executive Office for Immigration Review,DJ12
Community Relations Service,DJ14
"Bureau of Alcohol, Tobacco, Firearms, and Explosives",DJ15
Office of the Secretary of Labor,DLAA
Office of the Assistant Secretary for Administration and Management,DLAM
Bureau of International Labor Affairs,DLBL
Office of Congressional and Intergovernmental Affairs,DLCA
Office of the Chief Financial Officer,DLCF
Office of Disability Employment Policy,DLEH
Employment Standards Administration,DLES
Employment and Training Administration,DLET
Office of Inspector General,DLIG
Bureau of Labor Statistics,DLLS
Mine Safety and Health Administration,DLMS
National Skill Standards Board - terminated July 2003,DLNS
Office of Public Affairs,DLPA
Office of the Assistant Secretary for Policy,DLPE
Employee Benefits Security Administration,DLPW
Occupational Safety and Health Administration,DLSH
Office of the Solicitor,DLSL
Veterans' Employment and Training Service,DLVE
Women's Bureau,DLWB
Immediate Office of the Secretary of Education,EDEA
Office of the Deputy Secretary of Education,EDEB
Office for Civil Rights,EDEC
Office of the Under Secretary,EDEE
Office of Inspector General,EDEF
Office of the General Counsel,EDEG
Office of Special Education and Rehabilitative Services,EDEH
Office of the Chief Information Officer,EDEI
Office of Legislation and Congressional Affairs,EDEJ
Office of Finance and Operations,EDEK
Office of the Chief Financial Officer,EDEL
Office of Management,EDEM
Federal Student Aid,EDEN
Office of Postsecondary Education,EDEP
Office of Safe and Drug-Free Schools,EDEQ
Institute of Education Sciences,EDER
Office of Elementary and Secondary Education,EDES
Office of English Language Acquisition,EDET
Office of Innovation and Improvement,EDEU
"Office of Career, Technical, and Adult Education",EDEV
National Institute for Literacy,EDEX
Advisory Councils and Committees,EDEY
National Assessment Governing Board,EDEZ
"Energy, Bonneville Power Administration",DNBN
Immediate Office of the Administrator,GS01
Public Buildings Service,GS03
Office of Civil Rights,GS04
Office of Small Business Utilization,GS10
Office of the Chief Financial Officer,GS11
Office of General Counsel,GS12
Civilian Board of Contract Appeals,GS13
Office of Human Resources Management,GS14
Office of Inspector General,GS15
Office of Citizen Services and Innovative Technologies,GS19
Office of Congressional and Intergovernmental Affairs,GS20
Office of Smart Card Initiatives - terminated Dec 2002,GS21
Offices of the Regional Administrators,GS22
Federal Supply Service,GS24
Information Technology Service - terminated July 1998,GS25
Office of Governmentwide Policy,GS26
Federal Technology Service,GS27
Office of the Chief Information Officer,GS28
Office of Childcare,GS29
Office of the Secretary of Health and Human Services,HE10
Program Support Center,HE11
Administration for Community Living,HE12
Office of the Assistant Secretary for Health,HE31
Substance Abuse and Mental Health Services Administration,HE32
Agency for Healthcare Research and Quality,HE33
Health Resources and Services Administration,HE34
Agency for Toxic Substances and Disease Registry,HE35
Food and Drug Administration,HE36
Indian Health Service,HE37
National Institutes of Health,HE38
Centers for Disease Control and Prevention,HE39
Centers for Medicare & Medicaid Services,HE70
Administration for Children and Families,HE90
DHS Headquarters,HSAA
Citizenship and Immigration Services,HSAB
U.S. Coast Guard,HSAC
U.S. Secret Service,HSAD
Office of the Inspector General,HSAE
National Protection and Programs Directorate,HSBA
Immigration and Customs Enforcement,HSBB
Transportation Security Administration,HSBC
Customs and Border Protection,HSBD
Federal Law Enforcement Training Centers,HSBE
Cybersecurity and Infrastructure Security Agency,HSCA
Federal Emergency Management Agency,HSCB
Domestic Nuclear Detection Office,HSDA
Office for Information Analysis,HSDB
Office for Infrastructure Protection,HSDC
Under Secretary for Management,HSEA
Science and Technology Directorate,HSFA
Office of the Senior Coordinator for New England,HU01
Office of the Senior Coordinator for New York/New Jersey,HU02
Office of the Senior Coordinator for Mid-Atlantic,HU03
Office of the Senior Coordinator for Southeast/Caribbean,HU04
Office of the Senior Coordinator for Midwest,HU05
Office of the Senior Coordinator for Southwest,HU06
Office of the Senior Coordinator for Great Plains,HU07
Office of the Senior Coordinator for Rocky Mountains,HU08
Office of the Senior Coordinator for Pacific/Hawaii,HU09
Office of the Senior Coordinator for Northwest/Alaska,HU10
Office of the Secretary of Housing and Urban Development,HUAA
Office of the Chief Human Capital Officer,HUBB
Office of General Counsel,HUCC
Assistant Secretary for Community Planning and Development,HUDD
Assistant Secretary for Fair Housing and Equal Opportunity,HUEE
Office of the Chief Financial Officer,HUFF
Office of Inspector General,HUGG
Office of Departmental Operations and Coordination,HUII
Assistant Secretary for Congressional and Intergovernmental Relations,HUJJ
Center for Faith-Based and Community Initiatives,HUKA
Office of Field Policy and Management,HUKK
Office of Healthy Homes and Lead Hazard Control,HULL
Assistant Secretary for Housing-Federal Housing Commissioner,HUMM
Office of the Chief Procurement Officer,HUNN
Office of Federal Housing Enterprise Oversight,HUOO
Assistant Secretary for Public and Indian Housing,HUPP
Office of the Chief Information Officer,HUQQ
Assistant Secretary for Policy Development and Research,HURR
Government National Mortgage Association (Ginnie Mae),HUTT
Office of Departmental Equal Employment Opportunity,HUUU
Office of Disaster Management and National Security,HUVV
Assistant Secretary for Public Affairs,HUWW
Office of Strategic Planning and Management,HUXX
Office of Sustainable Housing and Communities,HUYY
Office of the Secretary of the Interior,IN01
Bureau of Land Management,IN05
"Interior, Bureau of Indian Affairs",IN06
Bureau of Reclamation,IN07
Geological Survey,IN08
National Park Service,IN10
U.S. Fish and Wildlife Service,IN15
Office of the Solicitor,IN21
Office of Surface Mining Reclamation and Enforcement,IN22
"Bureau of Ocean Energy Management, Regulation, and Enforcement",IN23
Office of Inspector General,IN24
"Headquarters, NASA",NN10
Ames Research Center,NN21
John Glenn Research Center at Lewis Field,NN22
Langley Research Center,NN23
Armstrong Flight Research Center,NN24
Goddard Space Flight Center,NN51
George C. Marshall Space Flight Center,NN62
John C. Stennis Space Center,NN64
Lyndon B. Johnson Space Center,NN72
Space Station Program Office,NN73
John F. Kennedy Space Center,NN76
Immediate Office of the Secretary of the Navy,NV08
Navy Staff Offices,NV09
Navy Field Offices,NV10
Immediate Office of the Chief of Naval Operations,NV11
Secretary of the Navy Offices (SECNAV),NV12
Office of Naval Research,NV14
Naval Intelligence Command,NV15
Naval Medical Command,NV18
Naval Air Systems Command,NV19
Bureau of Naval Personnel,NV22
Naval Supply Systems Command,NV23
Naval Sea Systems Command,NV24
Naval Facilities Engineering Systems Command,NV25
U.S. Marine Corps,NV27
STRATEGIC SYSTEMS PROGRAMS (SSP),NV30
Military Sealift Command,NV33
"Commander, Naval Information Warfare Systems Command (NAVWARSYSCOM)",NV39
Naval Systems Management Activity,NV41
United States Fleet Forces Command,NV60
"U.S. Naval Forces, Europe",NV61
Chief of Naval Education and Training,NV62
Naval Network Operations Cmd - terminated Jan 2003,NV63
Naval Meteorology and Oceanography Command,NV65
Naval Security Group Command,NV69
U.S. Pacific Fleet,NV70
Naval Reserve Force,NV72
Naval Special Warfare Command,NV74
U.S. Special Operations Command (Navy),NVZS
Armed Forces Retirement Home,RH00
Office of the Secretary of Transportation,TD01
Federal Aviation Administration,TD03
Federal Highway Administration,TD04
Federal Railroad Administration,TD05
Great Lakes Saint Lawrence Seaway Development Corporation,TD06
Federal Transit Administration,TD09
National Highway Traffic Safety Administration,TD10
Research and Innovative Technology Administration,TD11
Office of Inspector General,TD12
Maritime Administration,TD13
Surface Transportation Board,TD15
Pipeline and Hazardous Materials Safety Administration,TD16
Federal Motor Carrier Safety Administration,TD17
Office of Thrift Supervision,TR35
Alcohol and Tobacco Tax and Trade Bureau,TR40
"Treasury, Departmental Offices",TR91
Internal Revenue Service,TR93
Office of Inspector General,TR95
Bureau of the Fiscal Service (FMS),TRAA
Bureau of the Fiscal Service (BPD),TRAB
U.S. Mint,TRAD
"Treasury, Financial Crimes Enforcement Network",TRAF
Bureau of Engraving and Printing,TRAI
Office of the Comptroller of the Currency,TRAJ
Office of the Inspector General for Tax Administration,TRTG
Office of the Secretary,VAAA
Board of Contract Appeals,VAAC
Board of Veterans' Appeals,VAAD
General Counsel,VAAE
"Veterans Affairs, Inspector General",VAAF
Office of Small & Disadvantaged Business Utilization,VAAH
Immediate Office of the Assistant Secretary for Human Resources and Administration,VABA
Deputy Asst Sec for Security & Law Enforcement - terminated,VABB
Office of the Chief Human Capital Officer,VABC
Assistant Secretary for Diversity and Inclusion,VABD
Deputy Assistant Secretary for Administration,VABE
Deputy Assistant Secretary for Office of Resolution Management,VABF
Deputy Assistant Secretary for Corporate Senior Executive Management,VABG
Immediate Office of the Assistant Secretary for Management,VADA
Deputy Assistant Secretary for Budget,VADC
Deputy Assistant Secretary for Finance,VADD
"Executive Director, Office of Acquisition and Logistics",VADG
Immediate Office of the Assistant Secretary for Information and Technology,VAEA
Deputy Assistant Secretary for Information and Technology,VAEB
Office of Enterprise Integration,VAHA
Deputy Assistant Secretary for Program and Data Analysis,VAHB
Deputy Assistant Secretary for Planning and Evaluation,VAHC
National Center for Veteran Analysis and Statistics,VAHD
Office of the Assistant Secretary for Public and Intergovernmental Affairs,VAJA
Deputy Assistant Secretary for Intergovernmental Affairs,VAJB
Deputy Assistant Secretary for Public Affairs,VAJC
Immediate Office of the Assistant Secretary for Congressional and Legislative Affairs,VAKA
Deputy Assistant Secretary for Congressional Affairs,VAKB
Veterans Benefits Administration,VALA
National Cemetery Administration,VAPA
Veterans Health Administration,VATA
USAJOBS Staff Use Only,0000
Armed Forces Enlistment - No Civilian Jobs,0800
State Government,2000
State of California,2CA0
State of Georgia,2GA0
State of Hawaii,2HI0
State of Maryland,2MD0
State of New Jersey,2NJ0
State of Ohio,2OH0
State of Virginia,2VA0
Local and County Government,4000
District of Columbia Government,4DC0
Los Angeles County Government,4LA0
Oklahoma City Government,4OK0
Air Force National Guard,8FNG
Army/Air National Guard,8RNG
American Battle Monuments Commission,AB00
National Endowment for the Arts,AH01
National Endowment for the Humanities,AH02
Institute of Museum and Library Services,AH03
U.S. Institute Of Peace,AI00
U.S. Agency for International Development,AM00
African Development Foundation,AN00
Appalachian Regional Commission,AP00
Federal Labor Relations Authority,AU00
Arctic Research Commission,AW00
Merit Systems Protection Board,BD00
Defense Nuclear Facilities Safety Board,BF00
Pension Benefit Guaranty Corporation,BG00
Commission for the Preservation of America's Heritage Abroad,BH00
Illinois and Michigan Canal National Heritage Corridor Commission,BJ00
James Madison Memorial Fellowship Foundation,BK00
Office of Management and Budget,BO00
Architectural and Transportation Barriers Compliance Board,BT00
Nuclear Waste Technical Review Board,BW00
Christopher Columbus Fellowship Foundation,BZ00
Commission on Civil Rights,CC00
Council of Economic Advisers,CE00
Commission of Fine Arts,CF00
Central Intelligence Agency,CI00
Community Management,CICM
Commodity Futures Trading Commission,CT00
National Credit Union Administration,CU00
National Commission on Libraries and Information Science,CX00
Delta Regional Authority,DA00
Office of Policy Development,DC00
Export-Import Bank of the United States,EB00
Office of Administration,EC00
Equal Employment Opportunity Commission,EE00
Morris K. Udall Scholarship and Excellence in National Environmental Policy Foundation,EO00
Environmental Protection Agency,EP00
Council on Environmental Quality/Office of Environmental Quality,EQ00
"Commission on Executive, Legislative, and Judicial Salaries",ES00
Trade and Development Agency,EW00
Executive Residence at the White House,EX00
Federal Communications Commission,FC00
Federal Deposit Insurance Corporation,FD00
Federal Financial Institutions Examination Council,FI00
Chemical Safety and Hazard Investigation Board,FJ00
Farm Credit System Insurance Corporation,FK00
Farm Credit Administration,FL00
Federal Mediation and Conciliation Service,FM00
Office of the Director,FQ01
Pretrial Services Agency,FQ02
Federal Reserve System-Board Of Governors,FR00
Federal Trade Commission,FT00
Office of Special Counsel,FW00
Federal Housing Finance Board,FY00
Development Finance Corporation,GB00
Barry Goldwater Scholarship and Excellence in Education Foundation,GE00
Office of Government Ethics,GG00
Presidio Trust,GJ00
Valles Caldera Trust,GM00
White House Commission on the National Moment of Remembrance,GN00
Vietnam Education Foundation,GO00
International Boundary and Water Commission: United States and Mexico,GW00
International Boundary Commission: United States and Canada,GX00
International Joint Commission: United States and Canada,GY00
Committee for Purchase from People Who Are Blind or Severely Disabled,HB00
U.S. Holocaust Memorial Museum,HD00
Advisory Council on Historic Preservation,HP00
Harry S. Truman Scholarship Foundation,HT00
U.S. Agency for Global Media,IB00
Inter-American Foundation,IF00
U.S. Courts,JL02
Administrative Office of the U.S. Courts,JL04
